Timestamp,Name,Vendor,Organization,Website,Previous-Submission,Email,Phone,Employer,Job-Title,Biography,Co-presenter,Co-presenter-Name(s),Multi-Session,Multi-Session-Number,"Availability [Thursday, October 13th - Session 1]","Availability [Thursday, October 13th - Session 2]","Availability [Thursday, October 13th - Session 3]","Availability [Friday, October 14th - Session 4]","Availability [Friday, October 14th - Session 5]",Session,Presentation-Title,Objectives,Presentation-Abstract,Presentation-Description,Conference-Strand,File-Upload,Newsletter,Groups - Proposals - Send Status
2010,Nancy Laprade,,,,,,,,,"Nancy Laprade is a Senior Policy Associate with the Corporation for a Skilled Workforce (CSW), a not-for-profit headquartered in Ann Arbor, Michigan. Her work focuses on bringing effective sector and employer-based workforce strategies to scale. Prior to joining CSW, Nancy was founder and president of The Pawleys Group, a project management and consulting firm that assisted businesses, not-for-profits, education and government agencies with developing workforce and organizational solutions. Nancy was also the Executive Director of the Kentucky Workforce Investment Board (KWIB) and spent 15 years as a workforce development professional in New Hampshire.",TRUE,Katrina Wert,TRUE,2,,,,,,Session 4,"We Can’t Do It Alone - Leveraging Partnerships for Greater Success, Part 1",PD Self Assessment Descriptors: none,"This two-part workshop will provide educators and administrators with tools to build or enhance partnerships with the public workforce system, as well as businesses and community colleges. Part One will overview resources available through the workforce system and provide regional and national examples of successful leveraged partnerships. Part Two will feature a panel of education and workforce partners discussing the benefits of partnership and demonstrating strategies to successful partnerships that expand career development opportunities for students.",,Workforce,,,
2010,Kat Bradley-Bennett,,,,,,,,,"Kat Bradley-Bennett teaches ESL for St. Vrain Valley Adult Education, is a Library Assistant for the Northern Colorado Professional Development Resource Center and has the Literacy Instruction Authorization through the Colorado Department of Education.",TRUE,"Nadeen Lester, Nancy Nangle",,,,,,,,Session 4,Learner-Centered Instruction for the Adult Classroom,PD Self Assessment Descriptors: 2.3.5,What is learner-centered instruction? Why is it appropriate in an adult education setting? In this hands-on workshop participants will explore the principles of learner-centered instruction and how to implement more learner-centered instruction in any teaching setting (structured classes or one-on-one and small group instruction).,,ESL,,,
2010,Jane Miller,,,,,,,,,Jane Miller is the ESL Specialist in the Adult Education and Family Literacy (AEFL) office at the Colorado Department of Education.,,,,,,,,,,Session 4,Instruction for ESL Learners Bridging to ABE/ASE,"PD Self Assessment Descriptors: 7a.5, 7e.6","Members of this panel will describe the approaches they take for ESL learners bridging to ABE/ ASE instruction. They will share strategies for motivating these learners, assessing and placing them, determining a curriculum, training teachers, and providing instruction. Panelists explain what works for blending ESL methodology with ABE/ASE content.",,ESL,,,
2010,Jessie Hawthorn,,,,,,,,,"Jessie Hawthorn is a consultant in the Adult Education and Family Literacy (AEFL) office at the Colorado Department of Education. She has experience teaching ESL, ABE, ASE/GED, and family literacy. Jessie is the Learning Needs Coordinator in the AEFL office.",TRUE,"Connie Davis, Susan Harris",,,,,,,,Session 4,Learning Disabilities Training Available to Colorado Adult Educators,"PD Self Assessment Descriptors: 2.3.2, 6.10","The NIFL Learning to Achieve is a research-based training on serving learners with learning disabilities. In July 2010, 18 Colorado adult education professionals participated in this training. These individuals will be providing six to eight hours of free training to adult educators in their local areas. This session will provide an overview of the training content available and information about who to contact to learn about training in your area.",,General Teaching,,,
2010,Kate Goodspeed,,,,,,,,,"Kate Goodspeed has an MA in TESL from the University of Colorado at Denver, taught in China for eight years and has been teaching refugees and immigrants at Denver’s Emily Griffith Opportunity School for nine years. She is currently the lead teacher in the Work Intensive Skills Camp (WISC) program.",,,,,,,,,,Session 4,Stress-Free Activities for Pre-Literate Students,PD Self Assessment Descriptors: 7e.4.2,Are you tearing out your hair working with pre-literate adults who have never held a pencil? This presenter’s hair is growing back after developing many activities that work well with this challenging and rewarding population. Participants will join the presenter in these activities. Detailed handouts will be provided.,,ESL,,,
2010,Robin Leist,,,,,,,,,"Robin Leist, MA, has been the director of La Llave Family Resource Center for 12 years. She is a trainer for the Family Development Credential.",,,,,,,,,,Session 4,Family Development Work: The Promise of the Future,PD Self Assessment Descriptors: 8.5.2,"This interactive workshop shows how family workers can empower families to create their own futures with a shared power model. This method of working with families helps all family members find hope, self-respect, and freedom to become a self-reliant, positive force in their communities.",,Admin,,,
2010,Connie Davis,,,,,,,,,"Connie Davis works at the Northern Colorado Professional Development Resource Center in Longmont, CO. She has experience teaching ESL in Bolivia and Colorado in elementary school, community college, and adult education.",,,,,,,,,,Session 5,Igniting Learner Motivation and Learning,"PD Self Assessment Descriptors: 2.3.4, 2.3.5",Motivation is one of the most important factors in successful learning. This presentation highlights teaching strategies and activities to help captivate learner interest and increase motivation. A number of research- and experience-based strategies are modeled and discussed in this interactive session.,,General Teaching,,,
2010,Marcia Bettger,,,,,,,,,Marcia Bettger is in her fifth year as component manager and instructor at St. Vrain Valley Adult Education where she manages a program of more than 200 ABE students. She completed her undergraduate at the University of Colorado. Her graduate level work was at the University of Northern Colorado in Middle School Education.,TRUE,Rebecca Booterbaugh,,,,,,,,Session 5,Adults in the Margins: Educating Young Adults in an Adult Education Environment,"PD Self Assessment Descriptors: 2.3.10, 2.3.11, 2.3.15","Twenty-eight percent of learners attending adult education programs are between 17 and 24 years of age. Brain research shows the differences of this age group and their significance. This workshop will explore the unique needs of young adults and the Adult Theory of Learning. We will present research-based strategies for working with younger adults and address best practices for goal setting, retention, instruction, and administration among adults in the margins.",,ABE/ASE/GED,,,
2010,Dianna Baycich,,,,,,,,,Dianna Baycich is the Literacy Projects Coordinator for the Ohio Literacy Resource Center and coordinates the LINCS Basic Skills Collection.,,,TRUE,2,,,,,,Session 5,"Beyond the Five Paragraph Essay: Helping Learners Become Mature Writers, Part 1","PD Self Assessment Descriptors: 7a.3.3, 7e.5.4, 9.5","Participants will learn about the free, online research and research-based writing resources from the Literacy Information and Communication System (LINCS) project and how they can use these resources to guide their students to become more mature writers. Two other aspects of effective instruction, authenticity and scaffolding, will also be discussed.",,ABE/ASE/GED,,,
2010,Nancy Laprade,,,,,,,,,"Nancy Laprade is a Senior Policy Associate with the Corporation for a Skilled Workforce (CSW), a not-for-profit headquartered in Ann Arbor, Michigan. Her work focuses on bringing effective sector and employer-based workforce strategies to scale. Prior to joining CSW, Nancy was founder and president of The Pawleys Group, a project management and consulting firm that assisted businesses, not-for-profits, education and government agencies with developing workforce and organizational solutions. Nancy was also the Executive Director of the Kentucky Workforce Investment Board (KWIB) and spent 15 years as a workforce development professional in New Hampshire.",TRUE,Katrina Wert,TRUE,2,,,,,,Session 5,"We Can’t Do It Alone - Leveraging Partnerships for Greater Success, Part 2",PD Self Assessment Descriptors: none,"This two-part workshop will provide educators and administrators with tools to build or enhance partnerships with the public workforce system, as well as businesses and community colleges. Part One will overview resources available through the workforce system and provide regional and national examples of successful leveraged partnerships. Part Two will feature a panel of education and workforce partners discussing the benefits of partnership and demonstrating strategies to successful partnerships that expand career development opportunities for students.",,Workforce,,,
2010,Federico Salas-Isnardi,TRUE,unknown,,,,,,,"Federico Salas-Isnardi is the Adult Literacy Specialist at the Texas Center for the Advancement of Literacy and Learning at Texas A&M University in College Station, Texas. He has an MA in Applied English Linguistics from the University of Houston and is working on a PhD in Adult Education from Texas A&M University.",,,TRUE,2,,,,,,Session 5,"Adult Learning in the 21st Century: Skills and Literacy for Future Transitions, Part 1","PD Self Assessment Descriptors: 3.7, 5.7, 7a.5","What are the skills employers demand, the government recommends, and learners need? Successful transitions to higher education and high demand jobs start at the lowest levels of ABE and ESL. Thirty years of research support the teaching of 21st century skills, including expanded definitions of literacy. The Future is Today!",,ESL,,,
2010,Olivia Doll,,,,,,,,,Olivia Doll started her teaching career as an ESL teacher in the Denver Public Schools and is currently an adult ESL teacher for Boulder Valley Family Literacy. She has always been intrigued and fascinated by the intricacy and complexity of not only learning a new language but a new mindset.,TRUE,Celeste Perey,,,,,,,,Session 5,Parenting in ABE and ESL Classes for Everyone!,"PD Self Assessment Descriptors: 2.3.12, 8.1","Do you want to start a family literacy program, but are overwhelmed with the four components? Do adults in your program skip parent time and prefer to work straight through on ESL or GED? Ours did. Parenting instruction is now embedded in GED and ESL classes so all adults tackle challenging topics, learn how to support literacy development in children, and advocate for children. Come see the units and take home copies for your program.",,Admin,,,
2010,Kathy Holmes,,,,,,,,,Kathy Holmes has had more than 30 years in the field of adult education including ESL/ABE/ GED and training at the National Center for Family Literacy. She has worked with the Literacy Instruction Authorization Committee since 2004.,,,,,,,,,,Session 5,Preparing for LIA Renewal: Are You Ready?,PD Self Assessment Descriptors: none,"In this session, the revised renewal requirements for the Literacy Instruction Authorization (LIA) will be reviewed. The LIA credential for adult educators, issued by Educator Licensing at the Colorado Department of Education, is valid for five years from the date of issue. Tips on preparing for renewal will be shared. There will be an opportunity for questions.",,Admin,,,
2010,Ardith Loustalet,,,,,,,,,Ardith Loustalet is a Colorado State Trainer for CASAS Assessments and a consultant for the Northern Colorado Literacy Resource Center in Longmont.,,,,,,,,,,Session 5,"Improving Word Choice... One, Two, Three","PD Self Assessment Descriptors: 7e.5.4, 7e.5.5","The standardized CASAS Functional Writing Assessment officially verifies progress for adult learners at all intermediate and advanced ESL levels in Colorado. Teachers will leave this presentation with a three-step process and instructional activities to help learners gain new vocabulary, improve their writing, and increase their FWA scores.",,ESL,,,
2010,Jane Miller,,,,,,,,,Jane Miller is the ESL Specialist in the Adult Education and Family Literacy (AEFL) office at the Colorado Department of Education.,TRUE,"Kay Elder, Sara Hamilton",,,,,,,,Session 5,Adult Immigrants Improve English through USA Learns Website,"PD Self Assessment Descriptors: 6.4, 9.5, 9.8","The new USA Learns website for immigrant adults teaches English through videos and practice activities. Learn how this website can be effective with adult learners from Low Beginning to High Intermediate, with fluent technology users and rank beginners, through independent study, computer labs, and whole group presentation using SMART Boards.",,ESL,,,
2010,Susan Harris,,,,,,,,,"Susan Harris (ABD, MA, BSC) currently teaches Interpersonal plus Intercultural Communication and developmental reading at Trinidad State Junior College and has previously taught in adult education and high school.",,,,,,,,,,Session 6,"Brains, Bodies and Learning",PD Self Assessment Descriptors: 2.3.1,"For better or worse, we constantly change our brains. Current research tells us what we can do to enrich our capabilities for learning and memory (diet, exercise, connections, etc.) or to avoid decreasing them (stress, isolation, sleep deprivation, etc.). These insights apply to everyone-- learners, instructors, parents, young, and old alike.",,General Teaching,,,
2010,Margie Wagner,,,,,,,,,"Margie Wagner has been the Coordinator for the Center for Adult Learning at Front Range Community College since 1994 and has been in adult education since 1989. She has taught ESL, GED, and beginning reading using Lindamood-Bell Learning Processes. Margie’s leadership training includes the Russell Lockwood Leadership School and the Front Range Community College Career Enrichment Academy in Leadership Development.",,,,,,,,,,Session 6,Essential Attitudes of Good Leadership,PD Self Assessment Descriptors: none,There are many skills that are important to being a good leader. This workshop will approach the topic by exploring basic attitudes about life that lie behind good leadership practices.,,Admin,,,
2010,Dianna Baycich,,,,,,,,,Dianna Baycich is the Literacy Projects Coordinator for the Ohio Literacy Resource Center and coordinates the LINCS Basic Skills Collection.,,,TRUE,2,,,,,,Session 6,"Beyond the Five Paragraph Essay: Helping Learners Become Mature Writers, Part 2","PD Self Assessment Descriptors: 7a.3.3, 7e.5.4, 9.5","Participants will learn about the free, online research and research-based writing resources from the Literacy Information and Communication System (LINCS) project and how they can use these resources to guide their students to become more mature writers. Two other aspects of effective instruction, authenticity and scaffolding, will also be discussed.",,ABE/ASE/GED,,,
2010,Kate Goodspeed,,,,,,,,,"Kate Goodspeed taught eight years in China, has been teaching refugees at Emily Griffith Opportunity School for nine years, and helped create the Work Intensive Skills Camp program.",TRUE,Kim Hosp,,,,,,,,Session 6,Truly Preparing All ESL Levels for Work,PD Self Assessment Descriptors: 3.2.5,"Are you giving your adult ESL learners what they truly need to be successful in the workplace? After years of field research and running two innovative work skills programs, these presenters will share data on what employers really want and strategies to incorporate proven curriculum ideas into your own classes.",,ESL,,,
2010,Federico Salas-Isnardi,TRUE,unknown,,,,,,,"Federico Salas-Isnardi is the Adult Literacy Specialist at the Texas Center for the Advancement of Literacy and Learning at Texas A&M University in College Station, Texas. He has an MA in Applied English Linguistics from the University of Houston and is working on a PhD in Adult Education from Texas A&M University.",,,TRUE,2,,,,,,Session 6,"Adult Learning in the 21st Century: Skills and Literacy for Future Transitions, Part 2","PD Self Assessment Descriptors: 3.7, 5.7, 7a.5","What are the skills employers demand, the government recommends, and learners need? Successful transitions to higher education and high demand jobs start at the lowest levels of ABE and ESL. Thirty years of research support the teaching of 21st century skills, including expanded definitions of literacy. The Future is Today!",,ESL,,,
2010,Christine Tinner,,,,,,,,,"Christine Tinner, MS Education (Literacy) teaches GED and advanced ESL courses for Colorado Mountain College’s Aspen Campus. She is currently working on a PhD in Education, Curriculum, Instruction, and Assessment through Walden University.",,,,,,,,,,Session 6,Teaching ESL Adult Learners with Learning Disabilities,"PD Self Assessment Descriptors: 2.3.2, 6.10, 7e.4.1",Detecting adult learning disabilities—especially literacy disabilities—can be difficult. Adults with learning disabilities can be successful with learning when taught with the appropriate teaching strategies.,,ESL,,,
2010,Ardith Loustalet,,,,,,,,,Ardith Loustalet is a consultant for the Northern Colorado Literacy Resource Center in Longmont.,,,,,,,,,,Session 6,Effective Intake and Orientation,PD Self Assessment Descriptors: 2.3.11,"Research shows that the first few weeks in an adult education program are critical for learners. Effective intake, along with follow-up care by the Intake Specialist, is highly correlated with every learner’s continuing persistence. This presentation explores the “best practices” that will ensure effective intake and orientation for every learner.",,Admin,,,
2010,Shirley Penn,,,,,,,,,"Shirley Penn has been the coordinator of the Workplace Education Program with Cargill Meat Solutions and Morgan Community College for 17 years. A recent influx of new students from across the world has brought new challenges for the program. This past year, the program experimented with new strategies for teaching reading, while following recognized research in reading instruction. Shirley holds a BS in Elementary Education and an MS in Special Education from the University of Northern Colorado.",,,,,,,,,,Session 6,Meeting the Challenge: Guiding Success for the Beginning Adult Reader,"PD Self Assessment Descriptors: 5.5, 7a.3.2, 9.1, 9.6, 9.8",Do you need new strategies for working with the low-level adult reader? In this session you will learn about a new tool utilized by the Workplace Education Program at Morgan Community College. The use of MP3 players to augment reading instruction will be discussed.,,ABE/ASE/GED,,,